{
  "$schema": "https://json-schema.org/draft/2020-12/schema",
  "title": "Formal Research Execution Report",
  "description": "Formal research execution results by issue/subissue. This is the research gate; the search plan itself is lightweight scope-driven planning, not a hypothesis gate.",
  "type": "object",
  "required": ["schema_version", "formal_research_completed_at", "search_log", "issue_results"],
  "properties": {
    "schema_version": { "const": "formal_research_execution_report_v1" },
    "formal_research_completed_at": { "type": "string" },
    "search_log": { "type": "string" },
    "issue_results": {
      "type": "array",
      "minItems": 1,
      "items": {
        "type": "object",
        "required": [
          "result_id",
          "issue_area",
          "subissue",
          "research_question",
          "status",
          "search_instruction_ids",
          "search_attempt_ids",
          "selected_source_urls",
          "source_review_ids",
          "findings_summary",
          "limitations",
          "research_pack_handling"
        ],
        "properties": {
          "result_id": { "type": "string", "pattern": "^FR-\\d{3}$" },
          "issue_area": { "type": "string" },
          "subissue": { "type": "string" },
          "research_question": { "type": "string" },
          "status": {
            "type": "string",
            "enum": ["supported", "thin", "conflicting", "not_comparable", "insufficient", "unavailable_after_research"]
          },
          "search_instruction_ids": {
            "type": "array",
            "minItems": 1,
            "items": { "type": "string", "pattern": "^FS-\\d{3}$" }
          },
          "search_attempt_ids": { "type": "array", "items": { "type": "string" } },
          "source_discovery_attempt_ids": { "type": "array", "items": { "type": "string" } },
          "selected_source_urls": { "type": "array", "items": { "type": "string" } },
          "source_review_ids": { "type": "array", "items": { "type": "string" } },
          "evidence_ids": { "type": "array", "items": { "type": "string", "pattern": "^EV-\\d{3}$" } },
          "metric_ids": { "type": "array", "items": { "type": "string", "pattern": "^MET-\\d{3}$" } },
          "findings_summary": { "type": "string" },
          "limitations": { "type": "array", "items": { "type": "string" } },
          "research_pack_handling": { "type": "string" }
        },
        "additionalProperties": false
      }
    },
    "coverage_summary": {
      "type": "object",
      "properties": {
        "covered_issue_areas": { "type": "array", "items": { "type": "string" } },
        "thin_or_unresolved_subissues": { "type": "array", "items": { "type": "string" } },
        "not_available_after_research": { "type": "array", "items": { "type": "string" } }
      },
      "additionalProperties": true
    },
    "unresolved_issues": { "type": "array", "items": { "type": "string" } }
  },
  "additionalProperties": false
}
